{
  "schemaVersion": 1,
  "kind": "text-to-ui-scene",
  "source": {
    "visualBaseline": "http://127.0.0.1:43173/outputs/coremail-mail-home-v5/",
    "stateId": "coremail-inbox-expanded-default-v6",
    "purpose": "cross-renderer-complex-structure-benchmark"
  },
  "page": {
    "name": "Text-to-UI / Complex Structure Benchmark",
    "targetPage": "coremail",
    "viewport": { "width": 1000, "height": 520 },
    "pattern": "pattern-b-three-pane",
    "stateScope": "default-visible"
  },
  "nodes": [
    {
      "id": "benchmark-root", "name": "Complex structure benchmark", "type": "frame", "region": "global",
      "layout": { "direction": "HORIZONTAL", "width": 1000, "height": 520, "primaryAlign": "MIN", "counterAlign": "MIN", "clipsContent": true },
      "style": { "background": { "kind": "token", "token": "neutral-light/100" }, "radiusToken": "radius/16", "shadowRole": "shadow-2" },
      "children": [
        {
          "id": "benchmark-primary", "name": "Primary navigation pane", "type": "frame", "region": "primary-navigation",
          "layout": { "direction": "VERTICAL", "width": { "mode": "fixed", "token": "layout/primary-width" }, "height": "fill", "primaryAlign": "MIN", "counterAlign": "MIN", "clipsContent": true },
          "style": { "background": { "kind": "token", "token": "neutral-dark/05" }, "borderToken": "border/subtle" },
          "children": [
            {
              "id": "benchmark-primary-titlebar", "name": "Primary Titlebar", "type": "component", "region": "primary-navigation",
              "layout": { "direction": "HORIZONTAL", "width": "fill", "height": { "mode": "fixed", "token": "size/titlebar" }, "padding": { "left": "space/5", "right": "space/5" }, "primaryAlign": "MIN", "counterAlign": "CENTER", "clipsContent": false },
              "style": { "background": { "kind": "transparent" } },
              "component": { "logicalName": "Titlebar/L/Normal", "rendererKey": "titlebar", "reuse": "preferred", "state": "default", "props": { "label": "Coremail", "paneRole": "primary-navigation", "size": "large", "layout": "three-column" }, "slots": { "label": "Coremail" }, "fallbackRecipe": "titlebar" },
              "children": [
                { "id": "benchmark-brand", "name": "Coremail", "type": "text", "region": "primary-navigation", "content": "Coremail", "layout": { "direction": "VERTICAL", "width": "hug", "height": "hug", "primaryAlign": "MIN", "counterAlign": "MIN", "clipsContent": false }, "style": { "textColorToken": "text/primary", "textRole": "subtitle-m" } }
              ]
            },
            {
              "id": "benchmark-nav-list", "name": "Navigation states", "type": "frame", "region": "primary-navigation",
              "layout": { "direction": "VERTICAL", "width": "fill", "height": "hug", "padding": { "left": "space/4", "right": "space/4", "top": "space/5" }, "gap": "space/2", "primaryAlign": "MIN", "counterAlign": "MIN", "clipsContent": false },
              "style": { "background": { "kind": "transparent" } },
              "children": [
                {
                  "id": "benchmark-nav-selected", "name": "Selected inbox", "type": "component", "region": "primary-navigation",
                  "layout": { "direction": "HORIZONTAL", "width": "fill", "height": { "mode": "fixed", "token": "size/control" }, "padding": { "left": "space/4", "right": "space/4" }, "gap": "space/3", "primaryAlign": "MIN", "counterAlign": "CENTER", "clipsContent": true },
                  "style": { "background": { "kind": "token", "token": "brand/10" }, "radiusToken": "radius/08" },
                  "component": { "logicalName": "Sidebar Item/Default", "rendererKey": "sidebar", "reuse": "preferred", "state": "selected", "props": { "label": "收件箱", "icon": "navigation/inbox", "count": 28, "selected": true }, "slots": { "leading": "navigation/inbox", "label": "收件箱", "trailing": 28 }, "fallbackRecipe": "sidebar-item" },
                  "children": [
                    { "id": "benchmark-nav-selected-icon", "name": "Inbox icon", "type": "icon", "region": "primary-navigation", "semanticIcon": "navigation/inbox", "iconSize": 20, "layout": { "direction": "VERTICAL", "width": { "mode": "fixed", "token": "size/icon" }, "height": { "mode": "fixed", "token": "size/icon" }, "primaryAlign": "CENTER", "counterAlign": "CENTER", "clipsContent": true }, "style": { "textColorToken": "icon/primary" } },
                    { "id": "benchmark-nav-selected-label", "name": "Selected label", "type": "text", "region": "primary-navigation", "content": "收件箱", "layout": { "direction": "VERTICAL", "width": "fill", "height": "hug", "primaryAlign": "MIN", "counterAlign": "MIN", "clipsContent": false, "maxLines": 1, "overflow": "truncate" }, "style": { "textColorToken": "icon/primary", "textRole": "body-l" } },
                    { "id": "benchmark-nav-selected-count", "name": "Selected count", "type": "text", "region": "primary-navigation", "content": "28", "layout": { "direction": "VERTICAL", "width": "hug", "height": "hug", "primaryAlign": "MIN", "counterAlign": "MIN", "clipsContent": false }, "style": { "textColorToken": "text/secondary", "textRole": "body-m" } }
                  ]
                },
                {
                  "id": "benchmark-nav-default", "name": "Unselected mail", "type": "component", "region": "primary-navigation",
                  "layout": { "direction": "HORIZONTAL", "width": "fill", "height": { "mode": "fixed", "token": "size/control" }, "padding": { "left": "space/4", "right": "space/4" }, "gap": "space/3", "primaryAlign": "MIN", "counterAlign": "CENTER", "clipsContent": true },
                  "style": { "background": { "kind": "transparent" }, "radiusToken": "radius/08" },
                  "component": { "logicalName": "Sidebar Item/Default", "rendererKey": "sidebar", "reuse": "preferred", "state": "default", "props": { "label": "未读邮件", "icon": "navigation/mail-unread", "count": 12, "selected": false }, "slots": { "leading": "navigation/mail-unread", "label": "未读邮件", "trailing": 12 }, "fallbackRecipe": "sidebar-item" },
                  "children": [
                    { "id": "benchmark-nav-default-icon", "name": "Mail icon", "type": "icon", "region": "primary-navigation", "semanticIcon": "navigation/mail-unread", "iconSize": 20, "layout": { "direction": "VERTICAL", "width": { "mode": "fixed", "token": "size/icon" }, "height": { "mode": "fixed", "token": "size/icon" }, "primaryAlign": "CENTER", "counterAlign": "CENTER", "clipsContent": true }, "style": { "textColorToken": "icon/default" } },
                    { "id": "benchmark-nav-default-label", "name": "Default label", "type": "text", "region": "primary-navigation", "content": "未读邮件", "layout": { "direction": "VERTICAL", "width": "fill", "height": "hug", "primaryAlign": "MIN", "counterAlign": "MIN", "clipsContent": false, "maxLines": 1, "overflow": "truncate" }, "style": { "textColorToken": "text/primary", "textRole": "body-l" } },
                    { "id": "benchmark-nav-default-count", "name": "Default count", "type": "text", "region": "primary-navigation", "content": "12", "layout": { "direction": "VERTICAL", "width": "hug", "height": "hug", "primaryAlign": "MIN", "counterAlign": "MIN", "clipsContent": false }, "style": { "textColorToken": "text/secondary", "textRole": "body-m" } }
                  ]
                }
              ]
            }
          ]
        },
        {
          "id": "benchmark-secondary", "name": "Secondary list pane", "type": "frame", "region": "secondary-list",
          "layout": { "direction": "VERTICAL", "width": { "mode": "fixed", "token": "layout/secondary-width" }, "height": "fill", "primaryAlign": "MIN", "counterAlign": "MIN", "clipsContent": true },
          "style": { "background": { "kind": "token", "token": "neutral-light/100" }, "border": { "token": "border/subtle", "edges": ["left", "right"] } },
          "children": [
            {
              "id": "benchmark-secondary-titlebar", "name": "Secondary Titlebar", "type": "component", "region": "secondary-list",
              "layout": { "direction": "HORIZONTAL", "width": "fill", "height": { "mode": "fixed", "token": "size/titlebar" }, "padding": { "left": "space/5", "right": "space/5" }, "gap": "space/2", "primaryAlign": "MIN", "counterAlign": "CENTER", "clipsContent": true },
              "style": { "background": { "kind": "token", "token": "neutral-light/100" } },
              "component": { "logicalName": "Titlebar/L/Normal", "rendererKey": "titlebar", "reuse": "preferred", "state": "default", "props": { "label": "", "paneRole": "secondary-list", "size": "large", "layout": "three-column" }, "slots": {}, "fallbackRecipe": "titlebar" },
              "children": [
                {
                  "id": "benchmark-dropdown", "name": "Mailbox scope", "type": "component", "region": "secondary-list",
                  "layout": { "direction": "HORIZONTAL", "width": "hug", "height": { "mode": "fixed", "token": "size/control" }, "primaryAlign": "CENTER", "counterAlign": "CENTER", "clipsContent": true },
                  "style": {},
                  "component": { "logicalName": "Selection Dropdown/Default", "rendererKey": "selection-dropdown", "reuse": "required", "state": "default", "props": { "label": "全部", "variant": "secondary", "menuItems": ["全部", "未读邮件"], "disabled": false }, "slots": { "label": "全部", "trigger": "navigation/chevron-down" }, "fallbackRecipe": "selection-dropdown" },
                  "children": []
                },
                {
                  "id": "benchmark-search", "name": "Mail search", "type": "component", "region": "secondary-list",
                  "layout": { "direction": "HORIZONTAL", "width": "fill", "height": { "mode": "fixed", "token": "size/control" }, "minWidth": 120, "padding": { "left": "space/4", "right": "space/3" }, "gap": "space/3", "primaryAlign": "MIN", "counterAlign": "CENTER", "clipsContent": true },